{
  "lesson": 1,
  "title_en": "Nothing I see means anything.",
  "title_zh": "我所見的一切毫無意義",
  "keyword": "意義",
  "keyword_en": "Meaning",
  "availableMinds": ["ego", "spiritual_ego", "spirit"],

  "blocks": [
    {
      "id": 1,
      "text_en": "Nothing I see in this room means anything.",
      "text_zh": "這房間裡我所見的一切毫無意義。",

      "minds": {
        "ego": {
          "filters": ["恐懼", "分裂", "例外"],
          "main": "「有些有意義，有些沒意義。」",
          "innerVoice": [
            "什麼都沒意義？這太極端了。",
            "好，桌子可能沒意義，椅子可能沒意義。",
            "但我的孩子？我的身體？我的錢？",
            "這些當然有意義。",
            "課程一定不是這個意思。"
          ],
          "outputWorld": ["分裂", "判斷", "焦慮"]
        },

        "spiritual_ego": {
          "filters": ["靈性驕傲", "繞道", "否認"],
          "main": "「對，一切都是幻相，我早就知道了。」",
          "innerVoice": [
            "這個我懂，一切都是幻相。",
            "我已經不執著於這些東西了。",
            "不像那些還在追求物質的人。",
            "我是走在覺醒道路上的人。",
            "這一課對我來說太簡單了。"
          ],
          "outputWorld": ["靈性優越", "否認情緒", "假超脫"]
        },

        "spirit": {
          "filters": ["寬恕", "合一", "平等"],
          "quote": "Nothing I see means anything.",
          "main": "我所見的一切，都沒有我以為的那種意義。",
          "innerVoice": [
            "這不是說事物不存在，",
            "而是說你賦予它們的意義——",
            "那個讓你焦慮、讓你執著、讓你恐懼的意義——",
            "那個意義，不是真的。",
            "放下那些，你才能看見真相。"
          ],
          "outputWorld": ["平安", "自由", "清明"]
        }
      }
    },
    {
      "id": 2,
      "text_en": "This table does not mean anything. This chair does not mean anything.",
      "text_zh": "這張桌子毫無意義。這把椅子毫無意義。",

      "minds": {
        "ego": {
          "filters": ["物質", "擁有", "價值"],
          "main": "「桌子、椅子——好，可以沒意義。但我的東西呢？」",
          "innerVoice": [
            "桌子是桌子，沒什麼特別。",
            "但如果是我買的桌子？那就不一樣了。",
            "我花了錢，我選的，這代表我的品味。",
            "東西本身可能沒意義，但『我的』東西有。"
          ],
          "outputWorld": ["擁有", "執著", "身份認同"]
        },

        "spiritual_ego": {
          "filters": ["否認", "壓抑", "表演"],
          "main": "「我對物質沒有執著，這些對我來說真的沒意義。」",
          "innerVoice": [
            "我已經超越對物質的執著了。",
            "我可以隨時放下這些東西。",
            "（但如果有人弄壞我的東西，我還是會不高興...）",
            "（算了，我不應該有這種感覺。）"
          ],
          "outputWorld": ["假放下", "壓抑", "自欺"]
        },

        "spirit": {
          "filters": ["形式", "內容", "平等"],
          "quote": "This table does not mean anything.",
          "main": "桌子只是桌子。你加在它上面的故事，才是痛苦的來源。",
          "innerVoice": [
            "這張桌子不能給你安全感，",
            "也不能證明你的價值。",
            "當你不再需要它證明什麼，",
            "你才能單純地使用它。"
          ],
          "outputWorld": ["輕盈", "自在", "單純"]
        }
      }
    },
    {
      "id": 3,
      "text_en": "This hand does not mean anything.",
      "text_zh": "這隻手毫無意義。",

      "minds": {
        "ego": {
          "filters": ["身體", "死亡", "恐懼"],
          "main": "「等等——這是我的手！沒有手我怎麼活？」",
          "innerVoice": [
            "手是我的一部分。",
            "沒有手，我就不完整。",
            "這隻手打字、吃飯、擁抱——",
            "它怎麼可能沒意義？",
            "課程是不是要我否定自己的存在？"
          ],
          "outputWorld": ["身體認同", "死亡恐懼", "脆弱"]
        },

        "spiritual_ego": {
          "filters": ["解離", "否認身體", "假超越"],
          "main": "「身體本來就是幻相，我不是這個身體。」",
          "innerVoice": [
            "我知道我不是身體，我是靈魂。",
            "身體只是暫時的載具。",
            "我不應該太在意身體。",
            "（但我還是會怕痛、怕死...這代表我修得不夠好。）"
          ],
          "outputWorld": ["解離", "羞恥", "靈性自責"]
        },

        "spirit": {
          "filters": ["身份", "超越", "真我"],
          "quote": "This hand does not mean anything.",
          "main": "你不是你的手。你不是你的身體。",
          "innerVoice": [
            "手只是工具，",
            "它不能定義你是誰。",
            "你以為失去它就失去自己，",
            "但你遠比這隻手更大、更完整。",
            "你是使用這隻手的那個覺知。"
          ],
          "outputWorld": ["自由", "完整", "無懼"]
        }
      }
    },
    {
      "id": 4,
      "text_en": "One thing is like another as far as the application of the idea is concerned.",
      "text_zh": "就這觀念的應用而言，事物彼此相同。",

      "minds": {
        "ego": {
          "filters": ["比較", "特殊", "階級"],
          "main": "「不可能！有些東西就是比較重要！」",
          "innerVoice": [
            "所以鑽石和垃圾一樣？",
            "我的孩子和路邊的石頭一樣？",
            "這太荒謬了。",
            "當然有高低、有好壞、有重要不重要。",
            "這是基本常識。"
          ],
          "outputWorld": ["比較", "競爭", "永不滿足"]
        },

        "spiritual_ego": {
          "filters": ["靈性階級", "比較修行", "優越"],
          "main": "「對，萬物平等——但有些人的覺知程度確實比較高。」",
          "innerVoice": [
            "萬物平等，這我同意。",
            "但靈魂的進化程度是有差別的。",
            "有些人是老靈魂，有些人是年輕靈魂。",
            "我應該算是比較覺醒的那一群。"
          ],
          "outputWorld": ["靈性階級", "優越感", "分裂"]
        },

        "spirit": {
          "filters": ["平等", "源頭", "幻相"],
          "quote": "One thing is like another.",
          "main": "在這個練習中，萬物平等——因為它們都是你投射出去的。",
          "innerVoice": [
            "這不是說孩子和石頭的形式一樣，",
            "而是說：你對它們的執著，來自同一個源頭。",
            "你投射「特殊」在孩子身上，",
            "就像你投射「不重要」在石頭身上。",
            "兩者都是投射。"
          ],
          "outputWorld": ["平等", "清明", "真愛"]
        }
      }
    },
    {
      "id": 5,
      "text_en": "A comfortable sense of leisure is essential.",
      "text_zh": "從容不迫的心態是必要的。",

      "minds": {
        "ego": {
          "filters": ["急躁", "成就", "時間"],
          "main": "「我要一次就把這個做對。我要成功。」",
          "innerVoice": [
            "我要認真練習，每天都做。",
            "我要比昨天進步。",
            "還有 364 課，我得加快腳步。",
            "別人可能已經開悟了，我還在第一課。",
            "我不能浪費時間。"
          ],
          "outputWorld": ["焦慮", "壓力", "自我批判"]
        },

        "spiritual_ego": {
          "filters": ["靈性成就", "比較", "不夠好"],
          "main": "「我要成為一個好的課程學生，我要開悟。」",
          "innerVoice": [
            "我已經學課程三年了，應該要有進步。",
            "某某老師說他做到第 50 課就有體驗了。",
            "我是不是哪裡做錯了？",
            "我要更認真、更專注、更虔誠。",
            "為什麼我還沒有平安？"
          ],
          "outputWorld": ["靈性焦慮", "比較", "永不夠好"]
        },

        "spirit": {
          "filters": ["從容", "接納", "當下"],
          "quote": "A comfortable sense of leisure is essential.",
          "main": "從容不迫。這不是考試，這是邀請。",
          "innerVoice": [
            "你不需要做「對」。",
            "你不需要證明什麼。",
            "如果你忘了，沒關係。",
            "如果你分心了，沒關係。",
            "如果你懷疑，沒關係。",
            "只要你願意再看一次，就夠了。"
          ],
          "outputWorld": ["溫柔", "耐心", "信任"]
        }
      }
    }
  ]
}
